{
  "id": "webhook_770e8400-e29b-41d4-a716-446655440002",
  "type": "vote.created",
  "version": "1.0",
  "created_at": "2024-01-15T14:30:00Z",
  "attempt": 1,
  "data": {
    "vote": {
      "id": "330e8400-e29b-41d4-a716-446655440013",
      "userId": "550e8400-e29b-41d4-a716-446655440000",
      "section": "news",
      "itemId": "ee0e8400-e29b-41d4-a716-446655440009",
      "vote": "up",
      "isActive": true,
      "createdAt": "2024-01-15T14:30:00Z",
      "updatedAt": "2024-01-15T14:30:00Z"
    }
  }
}
