{
  "id": "webhook_550e8400-e29b-41d4-a716-446655440000",
  "type": "user.created",
  "version": "1.0",
  "created_at": "2024-01-15T10:30:00Z",
  "attempt": 1,
  "data": {
    "user": {
      "id": "550e8400-e29b-41d4-a716-446655440000",
      "email": "john.doe@example.com",
      "name": "John Doe",
      "hasCompletedOnboarding": false,
      "isActive": true,
      "createdAt": "2024-01-15T10:30:00Z",
      "updatedAt": "2024-01-15T10:30:00Z",
      "lastLoginAt": null
    }
  }
}
