{
  "id": "webhook_880e8400-e29b-41d4-a716-446655440003",
  "type": "recommendation.served",
  "version": "1.0",
  "created_at": "2024-01-15T15:00:00Z",
  "attempt": 1,
  "data": {
    "recommendation": {
      "id": "660e8400-e29b-41d4-a716-446655440016",
      "userId": "550e8400-e29b-41d4-a716-446655440000",
      "type": "news",
      "itemId": "ee0e8400-e29b-41d4-a716-446655440009",
      "title": "Bitcoin Analysis: Strong Buy Signal",
      "description": "Based on your HODLer profile and BTC holdings, this news suggests a strong buying opportunity.",
      "relevanceScore": 0.92,
      "reason": "Matches your BTC preference and HODLer investment style",
      "priority": "high",
      "isRead": false,
      "isDismissed": false,
      "expiresAt": "2024-01-16T14:30:00Z",
      "createdAt": "2024-01-15T15:00:00Z",
      "updatedAt": "2024-01-15T15:00:00Z"
    }
  }
}
