{
  "id": "webhook_660e8400-e29b-41d4-a716-446655440001",
  "type": "preference.updated",
  "version": "1.0",
  "created_at": "2024-01-15T11:45:00Z",
  "attempt": 1,
  "data": {
    "userId": "550e8400-e29b-41d4-a716-446655440000",
    "preferences": {
      "assets": [
        {
          "id": "990e8400-e29b-41d4-a716-446655440004",
          "userId": "550e8400-e29b-41d4-a716-446655440000",
          "assetId": "770e8400-e29b-41d4-a716-446655440002",
          "isActive": true,
          "createdAt": "2024-01-15T11:45:00Z",
          "updatedAt": "2024-01-15T11:45:00Z"
        }
      ],
      "contentTypes": [
        {
          "id": "cc0e8400-e29b-41d4-a716-446655440007",
          "userId": "550e8400-e29b-41d4-a716-446655440000",
          "contentTypeId": "aa0e8400-e29b-41d4-a716-446655440005",
          "isActive": true,
          "createdAt": "2024-01-15T11:45:00Z",
          "updatedAt": "2024-01-15T11:45:00Z"
        }
      ],
      "investorProfile": {
        "id": "dd0e8400-e29b-41d4-a716-446655440008",
        "userId": "550e8400-e29b-41d4-a716-446655440000",
        "investorType": "HODLer",
        "riskTolerance": "Medium",
        "investmentHorizon": "Long-term",
        "experienceLevel": "Intermediate",
        "createdAt": "2024-01-15T11:45:00Z",
        "updatedAt": "2024-01-15T11:45:00Z"
      }
    }
  }
}
